{
  "master_oauth": {
    "authorization_endpoint": "https://example.com/oauth/authorize",
    "token_endpoint": "https://example.com/oauth/token",
    "client_id": "master-mcp",
    "client_secret": "env:MASTER_OAUTH_CLIENT_SECRET",
    "redirect_uri": "http://localhost:3000/callback",
    "scopes": ["openid", "profile"],
    "audience": "master-mcp"
  },
  "hosting": {
    "platform": "node",
    "port": 3000
  },
  "logging": {
    "level": "info"
  },
  "routing": {
    "loadBalancer": { "strategy": "round_robin" },
    "circuitBreaker": { "failureThreshold": 5, "successThreshold": 2, "recoveryTimeoutMs": 30000 },
    "retry": { "maxRetries": 2, "baseDelayMs": 250, "maxDelayMs": 4000, "backoffFactor": 2, "jitter": "full" }
  },
  "servers": []
}

